<?xml version="1.0" encoding="UTF-8"?>
<!--
===============================================================================

  Copyright (c) 2013-2016 Qualcomm Technologies, Inc.
  All Rights Reserved.
  Confidential and Proprietary - Qualcomm Technologies, Inc.

===============================================================================
-->

<tns:secimage xmlns:tns="http://www.qualcomm.com/secimage"
    xmlns:xsi="http://www.w3.org/2001/XMLSchema-instance"
    xsi:schemaLocation="http://www.qualcomm.com/secimage ../xsd/secimage.xsd">

    <metadata>
        <chipset>default</chipset>
        <version>2.0</version>
    </metadata>

    <!--
       See documentation on general_properties below.
    -->
    <general_properties>
        <selected_signer>local</selected_signer>
        <selected_encryptor>unified_encryption_2_0</selected_encryptor>
        <selected_cert_config>qc_presigned_certs</selected_cert_config>

        <key_size>2048</key_size>
        <exponent>65537</exponent>

        <mrc_index>0</mrc_index>
        <num_root_certs>1</num_root_certs>

        <msm_part>0x00000000</msm_part>
        <oem_id>0x0000</oem_id>
        <model_id>0x0000</model_id>
        <debug>0x0000000000000002</debug>

        <max_cert_size>2048</max_cert_size>
        <num_certs_in_certchain>3</num_certs_in_certchain>
    </general_properties>

    <!--
        ***general_properties***

        The default properties for all images. These properties maybe overridden
        per image in the 'images' section below as needed.

        Supported signer are:
        local: use local signer with test keys

        Supported encryptor are:
        ssd_encryption: legacy encryption for OTA, supports MBN and ELF images.
        unified_encryption_2_0: supports ELF images. Image must be signed to encrypt

        msm_part: jtag_id for signing. (in hex)
        oem_id: oem_id for signing. (in hex)
        model_id: model_id for signing. (in hex)
        debug: debug_id for signing. (in hex)
        exponent: exponent value used in attestation key generation.

        max_cert_size: Maximum size (in bytes) of one certificate.
        key_size: Size (in bits) of the key used for signing.
        num_certs_in_certchain: Number of certificates in the certificate chain.
        num_root_certs: Number of root certificates in the certificate chain.
    -->

    <parsegen>
        <image_types_list>
            <image_type id='elf_wrapped_mbn'>
                <!-- Type of file format -->
                <file_type>ewm</file_type>

                <ewm_properties>
                    <image_entry>0x01200000</image_entry>
                    <relocatable>false</relocatable>
                </ewm_properties>

                <elf_properties>
                    <has_hash_table>false</has_hash_table>
                    <image_type>0</image_type>
                </elf_properties>

                <mbn_properties>
                    <header_size>80</header_size>
                </mbn_properties>

            </image_type>
        </image_types_list>
    </parsegen>

    <!-- Signing configurations used by secimage. -->
    <signing>
        <signer_attributes>
        </signer_attributes>
    </signing>

    <post_process>
        <pil_splitter>$(META_BUILD)/common/tools/misc/pil-splitter.py</pil_splitter>
    </post_process>

    <data_provisioning>
        <base_path>./../../resources/data_prov_assets/</base_path>
    </data_provisioning>

    <images_list>
        <image sign_id="sbl1" name="sbl1.mbn" image_type="elf_has_ht">
            <general_properties_overrides>
                <sw_id>0x0000000000000000</sw_id>
            </general_properties_overrides>
        </image>

        <image sign_id="sbl1_mbn" name="sbl1.mbn" image_type="mbn_80b">
            <general_properties_overrides>
                <sw_id>0x0000000000000000</sw_id>
            </general_properties_overrides>
        </image>

        <image sign_id="sbl1_nand" name="sbl1.mbn" image_type="elf_preamble">
            <general_properties_overrides>
                <sw_id>0x0000000000000000</sw_id>
            </general_properties_overrides>
        </image>

        <image sign_id="sbl1_hash_64b_align" name="sbl1.mbn" image_type="elf_end_64b_aligned">
            <general_properties_overrides>
                <sw_id>0x0000000000000000</sw_id>
            </general_properties_overrides>
        </image>

        <image sign_id="mba" name="mba.mbn" image_type="elf_has_ht">
            <general_properties_overrides>
                <sw_id>0x0000000000000001</sw_id>
            </general_properties_overrides>
        </image>

        <image sign_id="mba_mbn" name="mba.mbn" image_type="mbn_80b">
            <general_properties_overrides>
                <sw_id>0x0000000000000001</sw_id>
            </general_properties_overrides>
        </image>

        <image sign_id="mba_ewm" name="mba.mbn" image_type="elf_wrapped_mbn">
            <general_properties_overrides>
                <sw_id>0x0000000000000001</sw_id>
            </general_properties_overrides>
        </image>

        <image sign_id="qdsp6sw" name="qdsp6sw.mbn" image_type="elf_has_ht">
            <general_properties_overrides>
                <sw_id>0x0000000000000002</sw_id>
            </general_properties_overrides>
        </image>

        <image sign_id="emmcbld" name="MPRG*.mbn" image_type="elf_has_ht">
            <general_properties_overrides>
                <sw_id>0x0000000000000003</sw_id>
            </general_properties_overrides>
        </image>

        <image sign_id="emmcbld_mbn" name="MPRG*.mbn" image_type="mbn_80b">
            <general_properties_overrides>
                <sw_id>0x0000000000000003</sw_id>
            </general_properties_overrides>
        </image>

        <image sign_id="ENPRG_mbn" name="ENPRG*.mbn" image_type="mbn_80b">
            <general_properties_overrides>
                <sw_id>0x0000000000000003</sw_id>
            </general_properties_overrides>
        </image>

        <image sign_id="ENPRG" name="ENPRG*.mbn" image_type="elf_has_ht">
            <general_properties_overrides>
                <sw_id>0x0000000000000003</sw_id>
            </general_properties_overrides>
        </image>

        <image sign_id="NPRG_mbn" name="NPRG*.mbn" image_type="mbn_40b">
            <general_properties_overrides>
                <sw_id>0x0000000000000003</sw_id>
            </general_properties_overrides>
        </image>

        <image sign_id="NPRG" name="NPRG*.mbn" image_type="elf_has_ht">
            <general_properties_overrides>
                <sw_id>0x0000000000000003</sw_id>
            </general_properties_overrides>
        </image>

        <image sign_id="adsp" name="dsp*.mbn" image_type="elf_has_ht">
            <general_properties_overrides>
                <sw_id>0x0000000000000004</sw_id>
            </general_properties_overrides>
        </image>

        <image sign_id="devcfg" name="devcfg.mbn" image_type="elf_has_ht">
            <general_properties_overrides>
                <sw_id>0x0000000000000005</sw_id>
            </general_properties_overrides>
        </image>

        <image sign_id="acpi" name="acpi.mbn" image_type="elf_has_ht">
            <general_properties_overrides>
                <sw_id>0x0000000000000005</sw_id>
            </general_properties_overrides>
        </image>

        <image sign_id="tz" name="tz.mbn" image_type="elf_has_ht">
            <general_properties_overrides>
                <sw_id>0x0000000000000007</sw_id>
            </general_properties_overrides>
        </image>

        <image sign_id="appsboot" name="appsboot.mbn" image_type="elf_has_ht">
            <general_properties_overrides>
                <sw_id>0x0000000000000009</sw_id>
            </general_properties_overrides>
        </image>

        <image sign_id="appsbl" name="emmc_appsboot.mbn" image_type="elf_has_ht">
            <general_properties_overrides>
                <sw_id>0x0000000000000009</sw_id>
            </general_properties_overrides>
        </image>

        <image sign_id="uefi" name="uefi_sign_ready.mbn" image_type="elf_as_bin">
            <general_properties_overrides>
                <sw_id>0x0000000000000009</sw_id>
            </general_properties_overrides>
        </image>

        <image sign_id="rpm" name="rpm.mbn" image_type="elf_has_ht">
            <general_properties_overrides>
                <sw_id>0x000000000000000A</sw_id>
            </general_properties_overrides>
        </image>

        <image sign_id="imc" name="imc.mbn" image_type="elf_has_ht">
            <general_properties_overrides>
                <sw_id>0x000000000000000A</sw_id>
            </general_properties_overrides>
        </image>

        <image sign_id="wcnss" name="wcnss.mbn" image_type="elf_has_ht">
            <general_properties_overrides>
                <sw_id>0x000000000000000D</sw_id>
            </general_properties_overrides>
        </image>

        <image sign_id="vss" name="venus.mbn" image_type="elf_has_ht">
            <general_properties_overrides>
                <sw_id>0x000000000000000E</sw_id>
            </general_properties_overrides>
        </image>

        <image sign_id="apps" name="apps.mbn" image_type="elf_has_ht">
            <general_properties_overrides>
                <sw_id>0x000000000000000E</sw_id>
            </general_properties_overrides>
        </image>

        <image sign_id="avs" name="avs.mbn" image_type="elf_has_ht">
            <general_properties_overrides>
                <sw_id>0x0000000000000011</sw_id>
            </general_properties_overrides>
        </image>

        <image sign_id="sdi" name="sdi.mbn" image_type="elf_has_ht">
            <general_properties_overrides>
                <sw_id>0x0000000000000012</sw_id>
            </general_properties_overrides>
        </image>

        <image sign_id="sdi_mbn" name="sdi.mbn" image_type="mbn_40b">